id,conversation_id,created_at,date,time,timezone,user_id,username,name,place,tweet,language,mentions,urls,photos,replies_count,retweets_count,likes_count,hashtags,cashtags,link,retweet,quote_url,video,thumbnail,near,geo,source,user_rt_id,user_rt,retweet_id,reply_to,retweet_date,translate,trans_src,trans_dest
1508881680043552773,1508881680043552773,2022-03-29 14:00:00 CDT,2022-03-29,14:00:00,-0500,146569971,cdcgov,CDC,,"Growing evidence continues to show that #COVID19 vaccination before &amp; during pregnancy is safe &amp; effective. If you are pregnant or are planning a pregnancy, stay up to date on your #COVID19 vaccines, incl. your booster, to protect yourself &amp; your baby.  https://t.co/pBVlI6STf8  https://t.co/N4hPGxx4i5",en,[],['https://bit.ly/2WWh9hT'],[],52,75,400,"['covid19', 'covid19']",[],https://twitter.com/CDCgov/status/1508881680043552773,False,,1,https://pbs.twimg.com/amplify_video_thumb/1499051539339620352/img/KWwUhD9-yxGQ75nO.jpg,,,,,,,[],,,,
1508881380977135619,1508881380977135619,2022-03-29 13:58:49 CDT,2022-03-29,13:58:49,-0500,1411779940056510466,mikenotsoyeadon,Mike Yeadon's Left Hand Man,,"I think it's safe to say we now live in a crazy mind bending world where we're being led to believe an assault isn't assault, a gene therapy is a vaccine, a man is a woman, the BBC is value for money, and that the 'great reset' is a conspiracy theory!",en,[],[],[],23,272,804,[],[],https://twitter.com/Mikenotsoyeadon/status/1508881380977135619,False,,0,,,,,,,,[],,,,
1508881171849043975,1508881171849043975,2022-03-29 13:57:59 CDT,2022-03-29,13:57:59,-0500,1502998989003796482,katieappleseed2,Katie Appleseed,,After two years my unvaccinated friends remain healthier than my vaccinated friends who seem to get sick quite often now. It doesn't take a genius to look around and see the pandemic was fabricated and the vaccine is causing a lot of harm.,en,[],[],[],7,43,175,[],[],https://twitter.com/KatieAppleseed2/status/1508881171849043975,False,,0,,,,,,,,[],,,,
1508881130136739860,1508881130136739860,2022-03-29 13:57:49 CDT,2022-03-29,13:57:49,-0500,1096080214306840577,zqftn,LOOTBOY ZQ 🥷🏽,,"Vacciné 3 fois et j’ai le covid, jamais eu aussi mal à la gorge de ma vie depuis 3j je me disais bien pourquoi",fr,[],[],[],9,1,354,[],[],https://twitter.com/zqFTN/status/1508881130136739860,False,,0,,,,,,,,[],,,,
1508880726804123649,1508880726804123649,2022-03-29 13:56:13 CDT,2022-03-29,13:56:13,-0500,190012537,journo_dale,Dale Smith,,Mark Strahl calls vaccine mandates for domestic travel to be “cruel and vindictive.” Duclos says that getting COVID is indeed cruel. #QP,en,[],[],[],77,100,664,['qp'],[],https://twitter.com/journo_dale/status/1508880726804123649,False,,0,,,,,,,,[],,,,
1508879699899916300,1508870058302394372,2022-03-29 13:52:08 CDT,2022-03-29,13:52:08,-0500,1443994616781410307,darthgreggy,Greg 🍙🐧,,@bigcatburner69 @Waffles12415 @MySportsUpdate Seat belts don't prevent death full stop.  Vaccines don't prevent disease fu stop.  Your tweet didn't prevent this ratio full stop.,en,[],[],[],11,2,714,[],[],https://twitter.com/darthgreggy/status/1508879699899916300,False,,0,,,,,,,,"[{'screen_name': 'bigcatburner69', 'name': 'Cig Bat', 'id': '1243791377013641216'}, {'screen_name': 'Waffles12415', 'name': 'Mike', 'id': '1255978161784983553'}, {'screen_name': 'MySportsUpdate', 'name': 'Ari Meirov', 'id': '1312367672'}]",,,,
1508878699797512194,1508878699797512194,2022-03-29 13:48:10 CDT,2022-03-29,13:48:10,-0500,2301990517,barnes_law,Robert Barnes,,Big win for all of Navy against Biden vaccine mandate.   https://t.co/bcHxGzakGR,en,[],['https://vivabarneslaw.locals.com/upost/1919761/entire-navy-wins-injunction-on-vaccine-mandate'],[],8,94,297,[],[],https://twitter.com/barnes_law/status/1508878699797512194,False,,0,,,,,,,,[],,,,
1508878294443249669,1508876705401905153,2022-03-29 13:46:33 CDT,2022-03-29,13:46:33,-0500,1364650369,tincup2020,Ben Hogan 1953,,"@FoxNews I guess it's time to freighten everyone again and force them (essentially) into masks and more boosters.  This is all about the money the govt. has spent on vaccines, etc.  And we still don't know the long term effects of these vaccines.",en,[],[],[],21,3,196,[],[],https://twitter.com/TinCup2020/status/1508878294443249669,False,,0,,,,,,,,"[{'screen_name': 'FoxNews', 'name': 'Fox News', 'id': '1367531'}]",,,,
1508877823171252229,1508874733777047563,2022-03-29 13:44:41 CDT,2022-03-29,13:44:41,-0500,2843223040,boilerdave11,David Smith,,@drdavidsamadi 0 Is this the one that will finally work or are we just supposed to keep pretending this vaccine is effective?,en,[],[],[],1,8,250,[],[],https://twitter.com/BoilerDave11/status/1508877823171252229,False,,0,,,,,,,,"[{'screen_name': 'drdavidsamadi', 'name': 'Dr. David Samadi', 'id': '25816369'}]",,,,
1508875051960991744,1508875051960991744,2022-03-29 13:33:40 CDT,2022-03-29,13:33:40,-0500,1435494100535414785,niptxck,josh,,me to the new barbz when nicki made the vaccine tweet when i survived 2018-2019:  https://t.co/iG0J0qhVS5,en,[],[],[],36,185,1493,[],[],https://twitter.com/NIPTXCK/status/1508875051960991744,False,,1,https://pbs.twimg.com/ext_tw_video_thumb/1508867479464034323/pu/img/sbwaGqJOY94IqM8s.jpg,,,,,,,[],,,,
1508874733777047563,1508874733777047563,2022-03-29 13:32:24 CDT,2022-03-29,13:32:24,-0500,25816369,drdavidsamadi,Dr. David Samadi,,The FDA has now announced that the immunocompromised can get a fifth dose of an mNRA COVID-19 vaccine and those 50 and older can get a fourth booster dose.  What number shot are YOU on?,en,[],[],[],6762,1644,5519,[],[],https://twitter.com/drdavidsamadi/status/1508874733777047563,False,,0,,,,,,,,[],,,,
1508874085534740486,1508862803913977862,2022-03-29 13:29:50 CDT,2022-03-29,13:29:50,-0500,592339804,ginarosar,Gina HasNoFucks she/her 🏳️‍🌈🏳️‍⚧️ BLM 💉💉💉😷,,@blakleetee @RetroCrone You aren't dead and I assume you weren't hooked up to a vent so the vaccines did exactly what they were supposed to do. Keep you alive in the event you got covid.,en,[],[],[],3,6,387,[],[],https://twitter.com/GinaRosar/status/1508874085534740486,False,,0,,,,,,,,"[{'screen_name': 'blakleetee', 'name': 'blakleetee', 'id': '1324902293687263233'}, {'screen_name': 'RetroCrone', 'name': 'RetroCrone', 'id': '295003818'}]",,,,
1508872439953969152,1508872439953969152,2022-03-29 13:23:17 CDT,2022-03-29,13:23:17,-0500,1433663944267210753,charmchris3,chris,,"If the vaccine saves you from covid, what saves you from the vaccine?",en,[],[],[],37,25,194,[],[],https://twitter.com/charmchris3/status/1508872439953969152,False,,0,,,,,,,,[],,,,
1508872402272411655,1508872402272411655,2022-03-29 13:23:08 CDT,2022-03-29,13:23:08,-0500,222180430,brazilbrian,Brian Winter,,"Highway sign says “São Paulo, world capital of the vaccine.”   Sometimes people exaggerate but I think this title is deserved, basically &gt;99% of adults here vaccinated. Makes this American jealous  https://t.co/CKidcdpvyc",en,[],[],['https://pbs.twimg.com/media/FPCXaTeXEAYWQGX.jpg'],38,153,2244,[],[],https://twitter.com/BrazilBrian/status/1508872402272411655,False,,1,https://pbs.twimg.com/media/FPCXaTeXEAYWQGX.jpg,,,,,,,[],,,,
1508871493916135425,1508821711738839044,2022-03-29 13:19:32 CDT,2022-03-29,13:19:32,-0500,722491834140725248,vee_terra,Vee Terra🌈,,"@stevenchase Things a dictator does, according to the Conservative Party of Canada, apparently...  $10/day Childcare Pharmacare Dentalcare for kids Ensure enough effective vaccine for everyone Try to limit harm incurred by warming climate Help co-ordinate global response against Russia",en,[],[],[],94,61,430,[],[],https://twitter.com/vee_terra/status/1508871493916135425,False,,0,,,,,,,,"[{'screen_name': 'stevenchase', 'name': 'Steven Chase 🇨🇦🇱🇹', 'id': '16338550'}]",,,,
1508870659392348165,1508870659392348165,2022-03-29 13:16:13 CDT,2022-03-29,13:16:13,-0500,312412918,meetjess,Jess,,Are we really only going to depend on vaccines to get out of this pandemic ? Haven’t we learned that a vaccine++ strategy is the ONLY strategy ?!?  It’s been 2 years .. I’m exhausted  #CovidIsNotOver #WearAMask,en,[],[],[],14,38,260,"['covidisnotover', 'wearamask']",[],https://twitter.com/MeetJess/status/1508870659392348165,False,,0,,,,,,,,[],,,,
1508870437844897793,1508870437844897793,2022-03-29 13:15:20 CDT,2022-03-29,13:15:20,-0500,3843191833,k_blacck,DST Abolitionist,,Jim Carrey thinks vaccines cause autism so forgive me for not giving a shit about anything he says.,en,[],[],[],119,2857,18961,[],[],https://twitter.com/K_Blacck/status/1508870437844897793,False,https://twitter.com/TMZ/status/1508866126091997196,0,,,,,,,,[],,,,
1508870330680500232,1508867751993090056,2022-03-29 13:14:54 CDT,2022-03-29,13:14:54,-0500,214120461,ryanlcooper,ryan cooper,,"child allowance, climate policey, free vaccines &amp; treatment, these are all creeping socialism. time to get back to the usual high-mortality individualism (and yelling at The Left to pipe down)",en,[],[],[],4,22,185,[],[],https://twitter.com/ryanlcooper/status/1508870330680500232,False,,0,,,,,,,,[],,,,
1508870046185103363,1508870046185103363,2022-03-29 13:13:47 CDT,2022-03-29,13:13:47,-0500,1449429860846350340,lydia71469335,Lydia 🌻（澳喜特战旅）,,Dr Zelenko: The vaccine creates AIDS! 大胡子泽连科医生：疫苗导致艾滋病，毁坏免疫系统！以色列殡仪馆年轻人死亡数量增加10倍！  https://t.co/uhjXbI13wF,zh,[],[],[],0,211,162,[],[],https://twitter.com/Lydia71469335/status/1508870046185103363,False,,1,https://pbs.twimg.com/ext_tw_video_thumb/1508869663027040258/pu/img/3PEnu7ADFzf1KxtB.jpg,,,,,,,[],,,,
1508868889891024898,1508763306449899521,2022-03-29 13:09:11 CDT,2022-03-29,13:09:11,-0500,1284581290864513026,gekdat,Gekdat,,@Kiki79250CoC @BeyFR_ @BoySteveLeBg_ C'est des non vaccinés,fr,[],[],[],2,1,160,[],[],https://twitter.com/Gekdat/status/1508868889891024898,False,,0,,,,,,,,"[{'screen_name': 'Kiki79250CoC', 'name': '•••Kiki79250••• 🇺🇦', 'id': '3611189601'}, {'screen_name': 'BeyFR_', 'name': 'Bey | 🍥\uea00', 'id': '1364632191016333312'}, {'screen_name': 'BoySteveLeBg_', 'name': 'BoY-StEvE.mp4', 'id': '1280183318265434124'}]",,,,
1508868467272962056,1508868467272962056,2022-03-29 13:07:30 CDT,2022-03-29,13:07:30,-0500,736414651664224256,aragon_jb,JBAragon,,"France2 20h La taxe foncière va s'envoler dit Lapix mais sans mettre du tout en relation avec le Great Reset qui veut un monde de co-locataires, co-voiturés mais tous vaccinés... 🤣",fr,[],[],[],16,240,434,[],[],https://twitter.com/aragon_jb/status/1508868467272962056,False,,0,,,,,,,,[],,,,
1508867759215587329,1508862803913977862,2022-03-29 13:04:41 CDT,2022-03-29,13:04:41,-0500,2833740631,lovetotravel568,Marlene,,"@blakleetee @RetroCrone You’re alive!! The vaccine is meant to mitigate serious outcome, not totally prevent getting Covid.",en,[],[],[],14,3,244,[],[],https://twitter.com/lovetotravel568/status/1508867759215587329,False,,0,,,,,,,,"[{'screen_name': 'blakleetee', 'name': 'blakleetee', 'id': '1324902293687263233'}, {'screen_name': 'RetroCrone', 'name': 'RetroCrone', 'id': '295003818'}]",,,,
1508867744409608197,1508867744409608197,2022-03-29 13:04:38 CDT,2022-03-29,13:04:38,-0500,86626845,erictopol,Eric Topol,,New @CDCMMWR report Why it is important for people who had a J&amp;J vaccine to get a mRNA booster  https://t.co/uwEsmfsmC6  https://t.co/OeBkGSXkSE,en,"[{'screen_name': 'cdcmmwr', 'name': 'mmwr', 'id': '111354912'}]",['https://www.cdc.gov/mmwr/volumes/71/wr/mm7113e2.htm?s_cid=mm7113e2_w'],['https://pbs.twimg.com/media/FPCS-ZaUYAA-EAb.jpg'],13,74,204,[],[],https://twitter.com/EricTopol/status/1508867744409608197,False,,1,https://pbs.twimg.com/media/FPCS-ZaUYAA-EAb.jpg,,,,,,,[],,,,
1508866677043310600,1508866677043310600,2022-03-29 13:00:23 CDT,2022-03-29,13:00:23,-0500,716898927472152576,mistinguett17,Mistinguett,,"Va commencer le pire bashing Emmanuel Macron !  Cela va durer 15 jours ! Mais comme nous avons tout supporté pendant 5 ans avec notre Président, laissons-les s’agiter ! Ils nous ont vaccinés.  La jalousie aura été leur principal moteur.  Finiront à la Niche !",fr,[],[],[],4,47,127,[],[],https://twitter.com/Mistinguett17/status/1508866677043310600,False,,0,,,,,,,,[],,,,
1508866582612742154,1508866582612742154,2022-03-29 13:00:01 CDT,2022-03-29,13:00:01,-0500,1293113010941296640,sputnikvaccine,Sputnik V,,Mint: “Sputnik V becomes world’s first COVID vaccine with proven efficacy on HIV patients” 👇  https://t.co/o1GSb0fhqC,en,[],['https://www.livemint.com/companies/news/sputnik-v-become-first-covid-vaccine-with-proven-efficacy-on-hiv-patients-11648480290771.html'],[],7,37,161,[],[],https://twitter.com/sputnikvaccine/status/1508866582612742154,False,,0,,,,,,,,[],,,,
1508866543261782017,1508866543261782017,2022-03-29 12:59:51 CDT,2022-03-29,12:59:51,-0500,23949317,john_mcguirk,John McGuirk,,"Isn't the lesson of covid ultimately that... it just won? Nothing stopped it. Not lockdowns. Not masks. Not vaccines. It easily waited out the Zero Covid countries. Now with cases high and emergency powers going, we're just doing the right thing and surrendering unilaterally.",en,[],[],[],41,26,267,[],[],https://twitter.com/john_mcguirk/status/1508866543261782017,False,,0,,,,,,,,[],,,,
1508866531542941705,1508866531542941705,2022-03-29 12:59:49 CDT,2022-03-29,12:59:49,-0500,3383159573,doctor_oxford,Rachel Clarke,,"These attempts to rewrite history are so brazen &amp; disrespectful. 186k people are dead - not least because instead of suppressing the virus until we had vaccines, @BorisJohnson chose to let it rip in two catastrophic waves causing 10s of 1000s of avoidable deaths. Unforgivable.",en,"[{'screen_name': 'borisjohnson', 'name': 'boris johnson', 'id': '3131144855'}]",[],[],170,1565,5306,[],[],https://twitter.com/doctor_oxford/status/1508866531542941705,False,https://twitter.com/jessbrammar/status/1508814176684232712,0,,,,,,,,[],,,,
1508866495912235009,1508829763338747905,2022-03-29 12:59:40 CDT,2022-03-29,12:59:40,-0500,1393287564770041856,triag777,MoonBoots 🇨🇦,,"@TorontoTeacherX I'm confused here.  It seems like you're blaming the unmasked for vaccine failure.  Do I have that right? I bet the NEXT booster will fix everything. For sure, it will.  4th times a charm!",en,[],[],[],16,8,458,[],[],https://twitter.com/Triag777/status/1508866495912235009,False,,0,,,,,,,,"[{'screen_name': 'TorontoTeacherX', 'name': 'Toronto Teacher', 'id': '1442256078259974154'}]",,,,
1508865955966849026,1508865955966849026,2022-03-29 12:57:31 CDT,2022-03-29,12:57:31,-0500,19790393,lpco,Libertarian Party of Colorado,,What is the best vaccine to immunize people from believing government propaganda?,en,[],[],[],112,24,332,[],[],https://twitter.com/LPCO/status/1508865955966849026,False,,0,,,,,,,,[],,,,
1508865201709408259,1508865201709408259,2022-03-29 12:54:32 CDT,2022-03-29,12:54:32,-0500,593289567,peterhotez,Prof Peter Hotez MD PhD,,FDA authorizes fourth Pfizer and Moderna Covid vaccine doses for people age 50 and older: my comments ⁦@CNBC⁩   https://t.co/wARPF860w4,en,"[{'screen_name': 'cnbc', 'name': 'cnbc', 'id': '20402945'}]",['https://www.cnbc.com/2022/03/29/fda-authorizes-fourth-pfizer-covid-vaccine-dose-for-people-age-50-and-older-.html'],[],35,115,324,[],[],https://twitter.com/PeterHotez/status/1508865201709408259,False,,0,,,,,,,,[],,,,
1508863909968683011,1508863909968683011,2022-03-29 12:49:24 CDT,2022-03-29,12:49:24,-0500,1335695569331826689,badvaccinetakes,Bad Vaccine Takes,,I reckon 100% this person also thinks Covid vaccines = child abuse 🙈  https://t.co/oMvIFHSqEo,en,[],[],['https://pbs.twimg.com/media/FPCPuk5WUAYnSQI.jpg'],54,20,213,[],[],https://twitter.com/BadVaccineTakes/status/1508863909968683011,False,,1,https://pbs.twimg.com/media/FPCPuk5WUAYnSQI.jpg,,,,,,,[],,,,
1508861801609539585,1508861801609539585,2022-03-29 12:41:01 CDT,2022-03-29,12:41:01,-0500,3875780178,v1seuls,ERIKA 🪐,,jim carrey also thought children get autism from vaccines so there’s obviously something wrong in his own sense of judgment,en,[],[],[],41,50,420,[],[],https://twitter.com/V1SEULS/status/1508861801609539585,False,https://twitter.com/filmupdates/status/1508851538147647493,0,,,,,,,,[],,,,
1508861719371788289,1508861719371788289,2022-03-29 12:40:41 CDT,2022-03-29,12:40:41,-0500,586657636,olas_truth,Ola Ojewumi,,Jim Carrey is an anti-vaxxer. Why does his take on the Oscars matter? He's clearly toxic and ableist. I'll never forget him and Jenny McCarthy's campaign saying vaccines cause autism. He's harmful.   End of discussion.,en,[],[],[],11,41,150,[],[],https://twitter.com/Olas_Truth/status/1508861719371788289,False,https://twitter.com/Variety/status/1508851155178168320,0,,,,,,,,[],,,,
1508861431730655244,1508861431730655244,2022-03-29 12:39:33 CDT,2022-03-29,12:39:33,-0500,109680933,smashburgh,Mare,,*FDA approves 2nd booster vaccine*  5 minutes later on the phone  “Are you giving the 2nd booster?  Not yet?? THE NEWS SAID THAT IT WAS APPROVED”  Ok give the CDC and us a minute 🤦🏻‍♀️,en,[],[],[],8,10,129,[],[],https://twitter.com/smashburgh/status/1508861431730655244,False,,0,,,,,,,,[],,,,
1508860596091035659,1508856428701880324,2022-03-29 12:36:14 CDT,2022-03-29,12:36:14,-0500,404262337,jackrichardso99,Jack Richardson,,"@statsjamie Just the fact it can be confused with hay-fever or common cold now surely tells you we don’t need to obsess over testing anymore, otherwise what was the point of the vaccine?",en,[],[],[],3,7,252,[],[],https://twitter.com/JackRichardso99/status/1508860596091035659,False,,0,,,,,,,,"[{'screen_name': 'statsjamie', 'name': 'Jamie Jenkins', 'id': '101447362'}]",,,,
1508860060738330626,1508860060738330626,2022-03-29 12:34:06 CDT,2022-03-29,12:34:06,-0500,587716534,scigeekjulie,Julie Arsenault,,Oh the interesting looks I’m getting from other parents at @TELUS_Spark while my son &amp; I are the only ones masked &amp; I’m wearing my ‘Thanks Science’ vaccine shirt.,en,"[{'screen_name': 'telus_spark', 'name': 'telus spark science centre', 'id': '82162349'}]",[],[],95,100,2011,[],[],https://twitter.com/SciGeekJulie/status/1508860060738330626,False,,0,,,,,,,,[],,,,
1508859904806768641,1508859904806768641,2022-03-29 12:33:29 CDT,2022-03-29,12:33:29,-0500,294420379,veeren_jubbal,Veerender Jubbal,,"What is never not frustrating to me is we know masks work, we know vaccines work, we know social distancing works, allowing people to work from home works, we know boosters work, and we know active ventilation throughout schools work; but all of that money just goes to cops/wars.",en,[],[],[],4,49,131,[],[],https://twitter.com/Veeren_Jubbal/status/1508859904806768641,False,,0,,,,,,,,[],,,,
1508858627096031242,1508858627096031242,2022-03-29 12:28:24 CDT,2022-03-29,12:28:24,-0500,109802310,flahault,Antoine FLAHAULT,,"Les leçons #COVID19 de ces dernières sem sont édifiantes: 1. Hong-Kong: 50% des 80+ vaccinés, mortalité très élevée; 2. Corée, Japon, France: &gt;80% de vaccinés chez les 80+, mortalité 5 à 10 fois plus basse que HK. 3. Fortes contaminations en Corée: mortalité élevée en nb absolus.  https://t.co/UI1OitMXfU",fr,[],[],"['https://pbs.twimg.com/media/FPCK7HFXMAw09Pq.jpg', 'https://pbs.twimg.com/media/FPCK7HJXoAQpzSz.jpg']",19,96,148,['covid19'],[],https://twitter.com/FLAHAULT/status/1508858627096031242,False,,1,https://pbs.twimg.com/media/FPCK7HFXMAw09Pq.jpg,,,,,,,[],,,,
1508857562388701193,1508829763338747905,2022-03-29 12:24:10 CDT,2022-03-29,12:24:10,-0500,900819727,frankgrimes_jr,Frank Grimes Jr.,,@TorontoTeacherX One day you will come to realize the people who are questioning the vaccine and masks are just facing reality and they data. It isn't that they don't want these things to not work. It is that these things do not work. Don't blame the messenger.,en,[],[],[],9,53,731,[],[],https://twitter.com/FrankGrimes_Jr/status/1508857562388701193,False,,0,,,,,,,,"[{'screen_name': 'TorontoTeacherX', 'name': 'Toronto Teacher', 'id': '1442256078259974154'}]",,,,
1508856446120833037,1508856446120833037,2022-03-29 12:19:44 CDT,2022-03-29,12:19:44,-0500,1277562489882980352,linval59,BotOfficielDeRaoult,,"Je suis vacciné contre la rage, pourtant ça fait deux ans que je l’ai attrapé, doit pas marcher non plus ce vaccin !!!   🤣🤣🤣",fr,[],[],[],42,177,1207,[],[],https://twitter.com/linval59/status/1508856446120833037,False,,0,,,,,,,,[],,,,
1508855058649149442,1508855058649149442,2022-03-29 12:14:13 CDT,2022-03-29,12:14:13,-0500,41075989,nicoquejano,t.ocin.o,,Bayanihan E-Konsulta Swab Cab Vaccine Express Libreng PPE Libreng gamot Libreng pagkain Libreng dorm Libreng sakay Trabahope  Pandemic pa lang yan. Ituloy ko pa lahat ng Angat Buhay projects all over the Philippines???,tl,[],[],[],2,35,168,[],[],https://twitter.com/nicoquejano/status/1508855058649149442,False,https://twitter.com/itsmecaleb/status/1508808732809244682,0,,,,,,,,[],,,,
1508854288210087943,1508854288210087943,2022-03-29 12:11:10 CDT,2022-03-29,12:11:10,-0500,1180105262025207808,pdf00587301,pdf,,"FDA: ""Heart Attacks 71x higher than other vaccines"" 🔴🔴🔴🔴🔴🔴  @HanyaToderoff @sunlorrie @MaximeBernier @MarkFriesen08 @TransSplendor @lamphieryeg @bcbluecon @denisrancourt @pmcdunnough @jordanbpeterson @TheRealKeean @ezralevant",en,"[{'screen_name': 'hanyatoderoff', 'name': '♠️ ace of spades', 'id': '938193759375851521'}, {'screen_name': 'sunlorrie', 'name': 'lorrie goldstein', 'id': '255340030'}, {'screen_name': 'maximebernier', 'name': 'maxime bernier', 'id': '2791988124'}, {'screen_name': 'markfriesen08', 'name': '🇨🇦markfriesen🇨🇦 patriot & proud nationalist', 'id': '950558867099824128'}, {'screen_name': 'transsplendor', 'name': 'trans(je suis #ppc)', 'id': '967034117643579393'}, {'screen_name': 'lamphieryeg', 'name': 'gary lamphier', 'id': '38885578'}, {'screen_name': 'bcbluecon', 'name': 'dean skoreyko', 'id': '94021685'}, {'screen_name': 'denisrancourt', 'name': 'denis rancourt', 'id': '20340705'}, {'screen_name': 'pmcdunnough', 'name': 'pmcd', 'id': '1377884299106648085'}, {'screen_name': 'jordanbpeterson', 'name': 'dr jordan b peterson', 'id': '95092020'}, {'screen_name': 'therealkeean', 'name': 'keean bexte', 'id': '961134787'}, {'screen_name': 'ezralevant', 'name': 'ezra levant 🍁🚛', 'id': '20878297'}]",[],[],6,98,112,[],[],https://twitter.com/pdf00587301/status/1508854288210087943,False,https://twitter.com/Pepe559431421/status/1508850467081801733,0,,,,,,,,[],,,,
1508854002502586369,1508854002502586369,2022-03-29 12:10:02 CDT,2022-03-29,12:10:02,-0500,146569971,cdcgov,CDC,,"New @CDCMMWR: Adults who got an mRNA #COVID19 vaccine primary series &amp; booster had best protection against COVID-19-associated hospitalization during Omicron, compared with those who got Johnson &amp; Johnson Janssen #COVID19 vaccine with or without a booster.  https://t.co/U43gOCNHeD  https://t.co/TJsC8rTCWC",en,"[{'screen_name': 'cdcmmwr', 'name': 'mmwr', 'id': '111354912'}]",['http://bit.ly/MMWR7113e2'],['https://pbs.twimg.com/media/FPCGuAHX0AICqck.jpg'],57,83,140,"['covid19', 'covid19']",[],https://twitter.com/CDCgov/status/1508854002502586369,False,,1,https://pbs.twimg.com/media/FPCGuAHX0AICqck.jpg,,,,,,,[],,,,
1508853773090758656,1508853773090758656,2022-03-29 12:09:07 CDT,2022-03-29,12:09:07,-0500,83048182,astr0zombiez,madi ☠︎,,Jim hasn’t been in the cool club ever since he said vaccines cause autism and made fun of that 5 year old for it,en,[],[],[],3,10,133,[],[],https://twitter.com/ASTR0ZOMBIEZ/status/1508853773090758656,False,https://twitter.com/filmupdates/status/1508851538147647493,0,,,,,,,,[],,,,
1508852951351062529,1508852951351062529,2022-03-29 12:05:51 CDT,2022-03-29,12:05:51,-0500,849765930129281024,thereal_hurl,hurl,,It would be kinda funny if the Covid vaccine causes alopecia so every liberal would be bald.,en,[],[],[],24,30,114,[],[],https://twitter.com/TheReal_Hurl/status/1508852951351062529,False,,0,,,,,,,,[],,,,
1508852847873445892,1508852847873445892,2022-03-29 12:05:26 CDT,2022-03-29,12:05:26,-0500,1285627186045521921,bell00david,David Bell,,"One day people will ask why an emergency-use vaccine without long-term safety data, of a novel pharmaceutical type, was used in mostly-immune healthy children for a disease that rarely harms them.  It will be the subject of a lot of psychology theses.",en,[],[],[],10,82,282,[],[],https://twitter.com/bell00david/status/1508852847873445892,False,https://twitter.com/emmakennytv/status/1508747119825502210,0,,,,,,,,[],,,,
1508852311766052867,1508852311766052867,2022-03-29 12:03:18 CDT,2022-03-29,12:03:18,-0500,1042618220094648320,paliahabdul,Romeo S 🇩🇴,,Jim Carrey is literally responsible for popularizing anti vaccine rhetoric because he was there alongside his ex Jennie McCarthy promoting those views on massively popular platforms,en,[],[],[],6,250,1459,[],[],https://twitter.com/PalIahAbdul/status/1508852311766052867,False,https://twitter.com/FilmUpdates/status/1508851538147647493,0,,,,,,,,[],,,,
1508852135911436289,1508835747624800263,2022-03-29 12:02:36 CDT,2022-03-29,12:02:36,-0500,1335695569331826689,badvaccinetakes,Bad Vaccine Takes,,I love this one so here it is in a better font 😄  https://t.co/H3kOZ0kqXB,en,[],[],['https://pbs.twimg.com/media/FPCFBPMXIAwUhLz.jpg'],10,11,140,[],[],https://twitter.com/BadVaccineTakes/status/1508852135911436289,False,,1,https://pbs.twimg.com/media/FPCFBPMXIAwUhLz.jpg,,,,,,,[],,,,
1508851557307236352,1508851557307236352,2022-03-29 12:00:19 CDT,2022-03-29,12:00:19,-0500,759251,cnn,CNN,,The FDA authorized a second Covid-19 vaccine booster shot for adults 50 and older  https://t.co/ash7DKtY3n,en,[],['https://cnn.it/36Ygftt'],[],47,55,186,[],[],https://twitter.com/CNN/status/1508851557307236352,False,,0,,,,,,,,[],,,,
