id,conversation_id,created_at,date,time,timezone,user_id,username,name,place,tweet,language,mentions,urls,photos,replies_count,retweets_count,likes_count,hashtags,cashtags,link,retweet,quote_url,video,thumbnail,near,geo,source,user_rt_id,user_rt,retweet_id,reply_to,retweet_date,translate,trans_src,trans_dest
1508698498224603139,1508698498224603139,2022-03-29 01:52:06 CDT,2022-03-29,01:52:06,-0500,1434553194324152322,blemontd,Blemont Denis,,Plus de 20 millions d’euros ! Voilà ce que coutent les 450 000 tests effectués chaque jour par une population de vaccinés devenus hypocondriaques ! Franchement il y aurait tellement mieux à faire avec cet argent… c’est désespérant !,fr,[],[],[],6,63,127,[],[],https://twitter.com/BlemontD/status/1508698498224603139,False,,0,,,,,,,,[],,,,
1508698322407677952,1508698322407677952,2022-03-29 01:51:24 CDT,2022-03-29,01:51:24,-0500,1196765885878411264,dr_musgrave,Dr Katie Musgrave,,Do risks outweigh the benefits if a child has already had Covid? (vast majority of this age group).  Clear information &amp; transparency desperately needed before administering (still in trial) vaccines.  I have never seen anything like this in my career. 😰   https://t.co/7iejUCg9AL,en,[],['https://www.telegraph.co.uk/news/2022/03/28/covid-vaccines-children-aged-five-11-will-begin-next-week/'],[],223,524,1365,[],[],https://twitter.com/dr_musgrave/status/1508698322407677952,False,,0,,,,,,,,[],,,,
1508697154579099657,1508697154579099657,2022-03-29 01:46:46 CDT,2022-03-29,01:46:46,-0500,1352461223489486848,kantei_vaccine,首相官邸（新型コロナワクチン情報）,,"#新型コロナワクチン これまでの総接種回数(3月29日公表)   253,413,125回    （＋1,078,268）   ▼うち #３回目接種   50,371,163回 （＋1,000,740）   ※増分は、直近の公表値(3月28日公表)との差。   ▼詳細は新型コロナワクチンHPへ  https://t.co/cIInV5aHr9",ja,[],['https://kantei.go.jp/jp/headline/kansensho/vaccine.html'],[],25,152,290,"['新型コロナワクチン', '３回目接種']",[],https://twitter.com/kantei_vaccine/status/1508697154579099657,False,,0,,,,,,,,[],,,,
1508695678809223171,1508545976767762433,2022-03-29 01:40:54 CDT,2022-03-29,01:40:54,-0500,637232371,ryan27061986,Ryan,,@Telegraph Unless your 5-11 year old has an underlying health issue they don’t need a covid vaccine. At a time when the NHS is overwhelmed this is a complete waste of time. Focus on the elderly and vulnerable like we should have done at the start and leave children alone.,en,[],[],[],17,6,124,[],[],https://twitter.com/Ryan27061986/status/1508695678809223171,False,,0,,,,,,,,"[{'screen_name': 'Telegraph', 'name': 'The Telegraph', 'id': '16343974'}]",,,,
1508694610360803328,1508583294262444037,2022-03-29 01:36:39 CDT,2022-03-29,01:36:39,-0500,1397024575427284997,albertprins8,Albert Prins,,"@AAAopinion I am unvaccinated. Covid-19 for me was a mild cold. Maybe one bad day with fever, body-aches and chills. it was all over in a day and a half.  You've been lied to. The vaccine makes it far, far worse.",en,[],[],[],7,12,160,[],[],https://twitter.com/AlbertPrins8/status/1508694610360803328,False,,0,,,,,,,,"[{'screen_name': 'AAAopinion', 'name': 'Peter', 'id': '612484218'}]",,,,
1508694112148594692,1508660872448724994,2022-03-29 01:34:41 CDT,2022-03-29,01:34:41,-0500,1353703392267395073,jackoznyc,Jack Oz,,@nypost This is the guy who said he had a city to run when asked a tough question about vaccine mandates. charlatan.,en,[],[],[],0,2,189,[],[],https://twitter.com/JackOzNYC/status/1508694112148594692,False,,0,,,,,,,,"[{'screen_name': 'nypost', 'name': 'New York Post', 'id': '17469289'}]",,,,
1508691177989623809,1508691177989623809,2022-03-29 01:23:01 CDT,2022-03-29,01:23:01,-0500,17138582,cbcnewsbc,CBC British Columbia,,A B.C. doctor known for spreading false information about COVID-19 and who has been linked to a website selling fake vaccine exemption certificates has been suspended from practising medicine.   https://t.co/QZLGQyC2dK,en,[],['https://buff.ly/36S5yc0'],[],24,22,152,[],[],https://twitter.com/cbcnewsbc/status/1508691177989623809,False,,0,,,,,,,,[],,,,
1508685193531609088,1508656703977500672,2022-03-29 00:59:14 CDT,2022-03-29,00:59:14,-0500,228434828,ori0n7,Orion,,"@bonglez At this point anyone who hasn’t taken the vaccine has exercised the CHOICE not to.   The push to convince people to vaccinate couldn’t have been stronger, more persistent or more desperate. Just accept that people have made their decision.",en,[],[],[],10,21,270,[],[],https://twitter.com/ori0n7/status/1508685193531609088,False,,0,,,,,,,,"[{'screen_name': 'bonglez', 'name': 'Bongani Bingwa', 'id': '25822251'}]",,,,
1508684302619488258,1508684302619488258,2022-03-29 00:55:42 CDT,2022-03-29,00:55:42,-0500,838012831530352640,fcouilbault1,François Couilbault,,Il faudra qu’on nous explique pourquoi la plupart des vaccinés qui ont eu #Omicron ont été davantage malade que les non vaccinés et pourquoi beaucoup attrapent tous les virus qui traînent ?,fr,[],[],[],182,1146,3430,['omicron'],[],https://twitter.com/FCOUILBAULT1/status/1508684302619488258,False,,0,,,,,,,,[],,,,
1508670213801189376,1508534098406658056,2022-03-28 23:59:43 CDT,2022-03-28,23:59:43,-0500,80233893,jakeshieldsajj,Jake Shields,,@DrLeanaWen @CNN Why for vaccinated only when it’s now clear the vaccine doesn’t stop or slow the spread of covid?,en,[],[],[],42,13,704,[],[],https://twitter.com/jakeshieldsajj/status/1508670213801189376,False,,0,,,,,,,,"[{'screen_name': 'DrLeanaWen', 'name': 'Leana Wen, M.D.', 'id': '605153786'}, {'screen_name': 'CNN', 'name': 'CNN', 'id': '759251'}]",,,,
1508670206498983937,1508670206498983937,2022-03-28 23:59:41 CDT,2022-03-28,23:59:41,-0500,1112583419777683458,critica18495985,Critical Thinking 101(Expert of Expert Evaluation),,"If your pediatrician recommends the ""vaccine"" for your kid, imagine how they evaluate all other medical decisions.",en,[],[],[],12,49,290,[],[],https://twitter.com/critica18495985/status/1508670206498983937,False,,0,,,,,,,,[],,,,
1508667781205708803,1508667781205708803,2022-03-28 23:50:03 CDT,2022-03-28,23:50:03,-0500,1476707647890022403,drthompson22,Dr Thompson,,Every hour I think about how the government would rather kill kids than admit the vaccine isn’t so safe or effective.,en,[],[],[],289,3375,11898,[],[],https://twitter.com/DrThompson22/status/1508667781205708803,False,,0,,,,,,,,[],,,,
1508665106007158787,1508640248086990848,2022-03-28 23:39:25 CDT,2022-03-28,23:39:25,-0500,2661810312,drgerritsen,Sarah Gerritsen,,@NZStuff Hey @ChrisPenknz I also live in your electorate. Could you please represent me and the other 95% of us who are happy to receive a free vaccine to prevent unnecessary sickness and death in our community,en,"[{'screen_name': 'chrispenknz', 'name': 'chris penk', 'id': '25026571'}]",[],[],7,26,273,[],[],https://twitter.com/DrGerritsen/status/1508665106007158787,False,,0,,,,,,,,"[{'screen_name': 'NZStuff', 'name': 'Stuff', 'id': '15577108'}]",,,,
1508664907641675778,1508664907641675778,2022-03-28 23:38:38 CDT,2022-03-28,23:38:38,-0500,2887865951,k_g_andersen,Kristian G. Andersen,,"Looking forward to watching this.   I filmed with HBO in Jan 2021 - at 1:27 of the trailer I say ""new variants will emerge in areas of the world where vaccine coverage is much lower [..]""  Fast forward to 2022, those variants are now real and #VaccineEquity still a major issue.",en,[],[],[],7,45,208,['vaccineequity'],[],https://twitter.com/K_G_Andersen/status/1508664907641675778,False,https://twitter.com/sciencecohen/status/1508599242616557568,0,,,,,,,,[],,,,
1508664484625551368,1508664484625551368,2022-03-28 23:36:57 CDT,2022-03-28,23:36:57,-0500,188136549,unionsnsw,Unions NSW,,"Scott Morrison doesn't hold hose, doesn't order enough vaccines, doesn't give flooded communities enough support. #securejobs #Ausvotes22   What this sign in a sticker? Check it out:  https://t.co/L0IdqWGXZz  https://t.co/OpCcb4ShJK",en,[],['https://actionnetwork.org/fundraising/donate-5-or-more-to-receive-a-sticker-pack/manage/?source=social-facebook'],['https://pbs.twimg.com/media/FO_Zn7-UYAMAJ1-.jpg'],3,54,180,"['securejobs', 'ausvotes22']",[],https://twitter.com/unionsnsw/status/1508664484625551368,False,,1,https://pbs.twimg.com/media/FO_Zn7-UYAMAJ1-.jpg,,,,,,,[],,,,
1508664389905362948,1508532588939558920,2022-03-28 23:36:34 CDT,2022-03-28,23:36:34,-0500,53825245,rick_nunes,Riks 3: Vaccine Man 💉💉💉,,"@PH10Feliz @videosqvcsentir então quer dizer que o examinador que te passou normal, pegou no pau do instrutor à toa",pt,[],[],[],3,0,319,[],[],https://twitter.com/rick_nunes/status/1508664389905362948,False,,0,,,,,,,,"[{'screen_name': 'PH10Feliz', 'name': 'PH10', 'id': '1491831952776773640'}, {'screen_name': 'videosqvcsentir', 'name': 'videos que você pode sentir', 'id': '1481218050871508997'}]",,,,
1508661080180277254,1508583294262444037,2022-03-28 23:23:25 CDT,2022-03-28,23:23:25,-0500,530055099,82hd,Dr Trigger,,@AAAopinion Fact: A vaccine is to stop you getting a virus or a disease it’s not to help you through the symptoms.,en,[],[],[],26,18,368,[],[],https://twitter.com/82hd/status/1508661080180277254,False,,0,,,,,,,,"[{'screen_name': 'AAAopinion', 'name': 'Peter', 'id': '612484218'}]",,,,
1508659827442176001,1508659827442176001,2022-03-28 23:18:27 CDT,2022-03-28,23:18:27,-0500,28607570,ranvir01,ranvir singh,,Anyone else got the worst most painful stinging hay-fever they’ve ever had? I can barely keep my eyes open. If there was a vaccine for this I’d sign up asap :(,en,[],[],[],324,30,1321,[],[],https://twitter.com/ranvir01/status/1508659827442176001,False,,0,,,,,,,,[],,,,
1508656703977500672,1508656703977500672,2022-03-28 23:06:02 CDT,2022-03-28,23:06:02,-0500,25822251,bonglez,Bongani Bingwa,,We’re going to dump thousands of vaccines because they will expire. 92k doses of Pfizer alone by the end of this week. This as only 30% of us are fully vaxxed. Who’s to blame? Hesitancy or a shambolic rollout? Why are GP’s still not allowed to administer the jab? #702Breakfast,en,[],[],[],557,97,432,['702breakfast'],[],https://twitter.com/bonglez/status/1508656703977500672,False,,0,,,,,,,,[],,,,
1508655381056163844,1508655381056163844,2022-03-28 23:00:46 CDT,2022-03-28,23:00:46,-0500,1456081524827332615,storiesofinjury,COVID VACCINE INJURIES .COM,,"Does the vaccine work or not?   WTF do you need covid tests for, if you’ve been vaccinated?",en,[],[],[],36,26,133,[],[],https://twitter.com/Storiesofinjury/status/1508655381056163844,False,https://twitter.com/kathygriffin/status/1507536511348068352,0,,,,,,,,[],,,,
1508654361097908229,1508516695744393218,2022-03-28 22:56:43 CDT,2022-03-28,22:56:43,-0500,1439612632583970819,lirpaleppots,Aprillee,,"@stephan_nyc How soon will the deaths from the vaccine equal (or surpass) actual Covid deaths?   Not the overinflated numbers ""they"" claimed but the actual ones.",en,[],[],[],16,12,117,[],[],https://twitter.com/LirpaLeppots/status/1508654361097908229,False,,0,,,,,,,,"[{'screen_name': 'stephan_nyc', 'name': 'Stephan 🇺🇲', 'id': '1108027382861053952'}]",,,,
1508654188468883458,1508654188468883458,2022-03-28 22:56:02 CDT,2022-03-28,22:56:02,-0500,372791804,c_gaebler,Christian Gaebler,,"Our paper ""Evolution of antibody immunity to SARS-CoV-2"" has been selected as the 2021 Paper of the Year by the International Society for Vaccines! What a nice surprise and acknowledgment of the fantastic work by everyone involved and all 42 (!) authors!🙏  https://t.co/weYBStHWMV  https://t.co/0tsJTA6HUF",en,[],['https://isv-online.org/paper/isv-paper-year-2021'],['https://pbs.twimg.com/media/FO_PbslWUAYqrFo.jpg'],4,40,194,[],[],https://twitter.com/c_gaebler/status/1508654188468883458,False,,1,https://pbs.twimg.com/media/FO_PbslWUAYqrFo.jpg,,,,,,,[],,,,
1508654039847768068,1508654039847768068,2022-03-28 22:55:27 CDT,2022-03-28,22:55:27,-0500,1187103078060683264,rosey_nz,RoseyNZ,,Thank you @barrysoper for reporting the impacts that adverse vaccine reactions have had on some Kiwis who presented a petition to parliament today. It is appalling that @ACCNZ are rejecting these claims &amp; making these vax victims suffer even further.  #nzpol,en,"[{'screen_name': 'barrysoper', 'name': 'barry soper', 'id': '146379856'}, {'screen_name': 'accnz', 'name': 'acc new zealand', 'id': '1228478834'}]",[],[],4,35,122,['nzpol'],[],https://twitter.com/rosey_nz/status/1508654039847768068,False,,0,,,,,,,,[],,,,
1508653362585096198,1508653362585096198,2022-03-28 22:52:45 CDT,2022-03-28,22:52:45,-0500,1470293383373463554,theboon777,The B👀n,,"Strange, anyone that I know that is vaccine free and claims to have had ""covid"" hasn't suffered at all.",en,[],[],[],50,29,263,[],[],https://twitter.com/TheBoon777/status/1508653362585096198,False,https://twitter.com/AAAopinion/status/1508583294262444037,0,,,,,,,,[],,,,
1508651416554024962,1508621355603927040,2022-03-28 22:45:01 CDT,2022-03-28,22:45:01,-0500,99378911,inmanroshi,InmanRoshi,,"@mpp75214 @ModeledBehavior I mean ... there's degrees?   And ""I woke up from a coma   a Russian hospital after my quack daughter put me on an all meat and benzo diet and ever since then I've peddled anti-vaccine conspiracies and bible stories make me openly weep"" seems like pretty far on the spectrum.",en,[],[],[],5,10,688,[],[],https://twitter.com/InmanRoshi/status/1508651416554024962,False,,0,,,,,,,,"[{'screen_name': 'mpp75214', 'name': 'mpp75214', 'id': '792870403022532608'}, {'screen_name': 'ModeledBehavior', 'name': 'Adam Ozimek', 'id': '159904799'}]",,,,
1508650841384755200,1508650841384755200,2022-03-28 22:42:44 CDT,2022-03-28,22:42:44,-0500,1009022579900702721,johnruddick2,John Ruddick 🌸,,‘Today’s defenceless minority are those who have resisted the COVID vaccine. The world is against us. We cannot compare the treatment of the unvaccinated to the pogroms of the past but there are unmistakable early warning signs.’  https://t.co/jLpPbof7Sd,en,[],['https://spectator.com.au/2021/12/i-wont-take-the-vaccine-heres-why/'],[],64,161,632,[],[],https://twitter.com/JohnRuddick2/status/1508650841384755200,False,,0,,,,,,,,[],,,,
1508648200520884225,1508648200520884225,2022-03-28 22:32:14 CDT,2022-03-28,22:32:14,-0500,240599552,nickholtpodcast,Nick Holt,,She's half woman half vaccine.,en,[],[],[],46,14,175,[],[],https://twitter.com/nickholtpodcast/status/1508648200520884225,False,https://twitter.com/kathygriffin/status/1507536511348068352,0,,,,,,,,[],,,,
1508647795217117189,1508643606936043526,2022-03-28 22:30:38 CDT,2022-03-28,22:30:38,-0500,885891622919184384,billius27,Bill Comeau 🇨🇦🇺🇦,,"Of course with very high community transmission rates like we have now and with vaccine waning and Omicron (including BA.2) able to weaken vaccine protection against infection, the risk of getting infected and infecting others is generally higher for everyone.",en,[],[],[],3,22,169,[],[],https://twitter.com/Billius27/status/1508647795217117189,False,,0,,,,,,,,[],,,,
1508646131068071942,1508646131068071942,2022-03-28 22:24:01 CDT,2022-03-28,22:24:01,-0500,88877847,bethanylindsay,Bethany Lindsay,,"Well, it happened. Anti-vaccine doctor Stephen Malthouse is suspended from practice.   https://t.co/wkql5Ne2A9",en,[],['https://www.cbc.ca/news/canada/british-columbia/b-c-doctor-suspended-for-spreading-covid-19-misinformation-1.6400737'],[],38,100,522,[],[],https://twitter.com/bethanylindsay/status/1508646131068071942,False,,0,,,,,,,,[],,,,
1508642351266291713,1508642351266291713,2022-03-28 22:09:00 CDT,2022-03-28,22:09:00,-0500,391522328,toriamart,Jangled Nerves,,BREAKING: TX Federal Judge Grants Class Action Status To Navy SEALS In Lawsuit Against Secretary of Defense Austin Over Vaccine Mandates  https://t.co/PCEa5vcy2u,en,[],[],['https://pbs.twimg.com/media/FO_GIYWWUAEJ9a_.jpg'],2,60,137,[],[],https://twitter.com/ToriaMart/status/1508642351266291713,False,,1,https://pbs.twimg.com/media/FO_GIYWWUAEJ9a_.jpg,,,,,,,[],,,,
1508641865641656325,1508641850722201601,2022-03-28 22:07:04 CDT,2022-03-28,22:07:04,-0500,239210681,bob_wachter,Bob Wachter,,"There's lots to do! First, 4 vax shots markedly⬆chance of protection, even if the vaccines don't fully ""take"". (Unfortunately, antibody testing isn’t reliable in judging the response to vax, so if you’re on the CDC immunosuppressed list, you should just take the 4 shots.) (6/25)",en,[],[],[],3,16,194,[],[],https://twitter.com/Bob_Wachter/status/1508641865641656325,False,,0,,,,,,,,[],,,,
1508640483635253252,1508640483635253252,2022-03-28 22:01:35 CDT,2022-03-28,22:01:35,-0500,1367264302445469696,women4aus,Women for Australia (W4A),,I love how Scott thinks that $250 and a Jenny video will erase:  - #CostOfLiving pressure - Vaccine stroll-out - Women's issues - Climate inaction - RATs supplies - Corruption and rorts - Flood/fire responses  - Christian Porter - Subs contract   #auspol #Budget2022,en,[],[],[],8,70,193,"['costofliving', 'auspol', 'budget2022']",[],https://twitter.com/Women4Aus/status/1508640483635253252,False,,0,,,,,,,,[],,,,
1508640396641030144,1508640396641030144,2022-03-28 22:01:14 CDT,2022-03-28,22:01:14,-0500,1335569586951950342,realgeorgewebb1,George Webb - Investigative Journalist,,Waiting all week at Porton Down for MI6 and Christopher Steele to “get in the game” in Ukraine. It may have finally happened with Roman Abramovich and CCHF. Look for Gilead to commercialize the vaccine.  https://t.co/at3H7j8127,en,[],[],"['https://pbs.twimg.com/media/FO_EXq0XwAEh5bI.jpg', 'https://pbs.twimg.com/media/FO_EXqyXMAA1oUl.jpg', 'https://pbs.twimg.com/media/FO_EXt0XEAYjZZZ.jpg', 'https://pbs.twimg.com/media/FO_EXt1X0AcqbXr.jpg']",17,145,271,[],[],https://twitter.com/RealGeorgeWebb1/status/1508640396641030144,False,,1,https://pbs.twimg.com/media/FO_EXq0XwAEh5bI.jpg,,,,,,,[],,,,
1508640038120136707,1508440918046633987,2022-03-28 21:59:48 CDT,2022-03-28,21:59:48,-0500,745155157,ambulate666,xi Li variant whisperer 💉💩💵🤡🌍🐑,,@seancondev They're not vaccines,en,[],[],[],4,17,204,[],[],https://twitter.com/Ambulate666/status/1508640038120136707,False,,0,,,,,,,,"[{'screen_name': 'seancondev', 'name': 'Sean Conway - UAP 🇦🇺 ACT Senate Candidate', 'id': '1130049307313184768'}]",,,,
1508639684410286082,1508639684410286082,2022-03-28 21:58:24 CDT,2022-03-28,21:58:24,-0500,961113187453165569,franktheshank88,Franktheshank808,,"The real tragedy of our time is that even if there were a vaccine for stupidity, IDIOTS will NEVER get vaccinated!!! 🙄🙄🙄",en,[],[],[],10,23,120,[],[],https://twitter.com/Franktheshank88/status/1508639684410286082,False,,0,,,,,,,,[],,,,
1508639329710592007,1508639329710592007,2022-03-28 21:57:00 CDT,2022-03-28,21:57:00,-0500,146379856,barrysoper,Barry Soper,,National’s Chris Penk at parliament today receiving petition from Anna Hodgkinson whose daughter is in a wheelchair after receiving first Covid jab. They’re seeking recognition that the vaccine can have dire side effects.  https://t.co/KKEyXomd6g,en,[],[],['https://pbs.twimg.com/media/FO_DdXJaAAEPDep.jpg'],213,177,780,[],[],https://twitter.com/barrysoper/status/1508639329710592007,False,,1,https://pbs.twimg.com/media/FO_DdXJaAAEPDep.jpg,,,,,,,[],,,,
1508636088033710080,1508516695744393218,2022-03-28 21:44:07 CDT,2022-03-28,21:44:07,-0500,14900643,eyesopenindia,EyesOpen,,@stephan_nyc We in India do not have mRNA vaccines and people are not dying suddenly anywhere near as we see in the West.  Pfizer was asked to do a local clinical trial if they wanted to sell their vaccines in India.   And they ran away.,en,[],[],[],13,134,481,[],[],https://twitter.com/eyesopenindia/status/1508636088033710080,False,,0,,,,,,,,"[{'screen_name': 'stephan_nyc', 'name': 'Stephan 🇺🇲', 'id': '1108027382861053952'}]",,,,
1508633030902095875,1508633030902095875,2022-03-28 21:31:58 CDT,2022-03-28,21:31:58,-0500,841050351293853699,aceman6900,Stoneface,,Put on blood pressure pills for the first time in my life.   D-dimer is 2300 and now I have a bruise the size of a coconut on my inner calf...blood clot? This is 2 months post forced vaccine  https://t.co/hJrHluOEin,en,[],[],['https://pbs.twimg.com/media/FO-9vw_XMAEd37x.jpg'],151,457,1027,[],[],https://twitter.com/aceman6900/status/1508633030902095875,False,,1,https://pbs.twimg.com/media/FO-9vw_XMAEd37x.jpg,,,,,,,[],,,,
1508630793387909120,1508630793387909120,2022-03-28 21:23:04 CDT,2022-03-28,21:23:04,-0500,4216062853,sallylawry,💧Sally Lawry,,"Don’t take voters for mugs @ScottMorrisonMP and @JoshFrydenberg . $250 over 4 yrs is an insult . Morrison went to Hawaii during fires, made us wait for vaccines, got an award from Trump and is a liar. Frydenberg will be remembered as a disgrace during Covid and the car park liar",en,"[{'screen_name': 'scottmorrisonmp', 'name': 'scott morrison', 'id': '34116377'}, {'screen_name': 'joshfrydenberg', 'name': 'josh frydenberg', 'id': '63942152'}]",[],[],9,96,230,[],[],https://twitter.com/SallyLawry/status/1508630793387909120,False,,0,,,,,,,,[],,,,
1508630428357300224,1508630420597837825,2022-03-28 21:21:37 CDT,2022-03-28,21:21:37,-0500,86626845,erictopol,Eric Topol,,3. China relied exclusively on Sinovac and Sinopharm vaccines; there is a substantial gap of 1- and 2-dose protection vs Omicron deaths compared with an mRNA vaccine. This evens out with a booster shot  https://t.co/VfP93kW9IL,en,[],[],['https://pbs.twimg.com/media/FO-504WVgAMF6np.jpg'],9,65,246,[],[],https://twitter.com/EricTopol/status/1508630428357300224,False,,1,https://pbs.twimg.com/media/FO-504WVgAMF6np.jpg,,,,,,,[],,,,
1508630421881655299,1508630421881655299,2022-03-28 21:21:36 CDT,2022-03-28,21:21:36,-0500,1445243235186532354,patriotnz2022,Freedom over Fear🌸,,So vaccine passes don't actually drop until Tuesday.   What's this 11.59 pm shit.,en,[],[],[],30,12,174,[],[],https://twitter.com/PatriotNz2022/status/1508630421881655299,False,,0,,,,,,,,[],,,,
1508628491864006656,1508516695744393218,2022-03-28 21:13:56 CDT,2022-03-28,21:13:56,-0500,1214850699038789632,sulphuricrayne,🖤Rayne Storm🖤,,"@stephan_nyc This is real. She was only 36 years old. She was trying to get a vaccine drive-thru program implemented, to vax more people as quickly as possible.  https://t.co/xx0gq3t7vm",en,[],['https://www.courier-journal.com/story/news/local/2022/03/18/dr-sarahbeth-hartlage-who-led-louisvilles-covid-vaccine-effort-dies/7090533001/?fbclid=IwAR2iwTgvZFbBKFSVSZyVS5bXW7wyH8ldIdfun5AXoVJr5FQOpI5dMalESt8'],[],48,126,237,[],[],https://twitter.com/SulphuricRayne/status/1508628491864006656,False,,0,,,,,,,,"[{'screen_name': 'stephan_nyc', 'name': 'Stephan 🇺🇲', 'id': '1108027382861053952'}]",,,,
1508626335652012038,1508626335652012038,2022-03-28 21:05:21 CDT,2022-03-28,21:05:21,-0500,16187240,jonkay,Jonathan Kay,,The WHO rejects an effective Canadian COVID vaccine because .... there's a 21% ownership stake by a tobacco company? How does it make sense to limit the availability of life-saving medicine because a company you don't like has a minority equity stake???   https://t.co/lrnokySdWz,en,[],['https://www.cp24.com/news/who-reviewing-policy-after-rejecting-emergency-use-of-canadian-made-covid-19-vaccine-1.5835076'],[],58,69,353,[],[],https://twitter.com/jonkay/status/1508626335652012038,False,,0,,,,,,,,[],,,,
1508624196535996428,1508548776797130758,2022-03-28 20:56:51 CDT,2022-03-28,20:56:51,-0500,1157748392430309377,rossschumann,Ross Schumann,,"@Th3MFG @POTUS Yes, when house Dems held COVID relief funding hostage for massive spending to pad the bank accounts of their campaign donors.  Remember when Nancy said we couldn’t fund vaccine research unless we gave 125 million to the Kennedy center?  90% of that bill didn’t relate to COVID.",en,[],[],[],7,9,129,[],[],https://twitter.com/RossSchumann/status/1508624196535996428,False,,0,,,,,,,,"[{'screen_name': 'Th3MFG', 'name': 'SilenceDoGood', 'id': '1234301956077838336'}, {'screen_name': 'POTUS', 'name': 'President Biden', 'id': '1349149096909668363'}]",,,,
1508623256244428807,1508623256244428807,2022-03-28 20:53:07 CDT,2022-03-28,20:53:07,-0500,977561048214630400,flingflangqc,Le Dôme,,"Donc si je comprends bien, nous sommes l’endroit le plus vacciné, la place avec le plus de restrictions et de psychose relié à la COVID, mais où il y a le plus de cas?!?   Ça fait du sens!!",fr,[],[],[],16,65,375,[],[],https://twitter.com/flingflangqc/status/1508623256244428807,False,,0,,,,,,,,[],,,,
1508621600437985280,1508621600437985280,2022-03-28 20:46:33 CDT,2022-03-28,20:46:33,-0500,181936367,breannamorello,Breanna Morello,,"Fox News/Fox Business required me to be vaccinated in order to enter their NYC office.  As a result, I resigned from my role as a producer.  I later learned they took money from Joe Biden’s HHS to promote the COVID vaccine.  That’s why they complied.  COWARDS.",en,[],[],[],70,310,1237,[],[],https://twitter.com/BreannaMorello/status/1508621600437985280,False,,0,,,,,,,,[],,,,
1508621511040503813,1508621511040503813,2022-03-28 20:46:11 CDT,2022-03-28,20:46:11,-0500,825552505153036289,kimberprime,Kimber Prime,,No stream tonight as I'm still really tired from the vaccine. Will be back on Thursday like normal ❤  In the meantime here's me having fun with my new ogre friend.  https://t.co/I7jKgZ7gDO,en,[],[],[],8,23,266,[],[],https://twitter.com/KimberPrime/status/1508621511040503813,False,,1,https://pbs.twimg.com/ext_tw_video_thumb/1508621469059731457/pu/img/PYdpNMD10H8ZZ_fE.jpg,,,,,,,[],,,,
